{
  "accepted_rung": "E1",
  "base_sha": "2fe3bc7e43c89b317caceeb4d627657cf7c50729",
  "batch_id": "A0-governed-research-access",
  "commands": [
    {
      "command": "uv run pytest libs/contracts/tests/test_access.py -q",
      "exit_code": 0,
      "output_sha256": "0c3707ffad0ce8ce3abb40ad93b8977c81931acb2b7c65c36390125d47cf3970"
    },
    {
      "command": "uv run ruff check libs/contracts/src/truealpha_contracts/access.py libs/contracts/tests/test_access.py",
      "exit_code": 0,
      "output_sha256": "c822b811c2e0019bee1324669633ca6aa6ae681c738309b0a31c13bbeebac766"
    },
    {
      "command": "uv run mypy",
      "exit_code": 0,
      "output_sha256": "55c1a1546fc041d4b1f469088abc8b81d35b560fbda44538abb7cd83c7d2a941"
    },
    {
      "command": "psql \"$DATABASE_URL\" -v ON_ERROR_STOP=1 -f db/tests/governed_research_access_contract.sql",
      "exit_code": 0,
      "output_sha256": "befaf160a91fd8ca9ac693ab3626bf6d153c530787746185dc0afaec568d93e6"
    },
    {
      "command": "uv run python tools/check_delivery_governance.py",
      "exit_code": 0,
      "output_sha256": "3ce0a3f4b2b2d3fcc83181896297ac73b4b7b3034209f9e2b7514b3d55b0ebfa"
    }
  ],
  "created_at": "2026-07-16T04:51:47.205797Z",
  "evidence_id": "rung-evidence:A0-governed-research-access:f374d0ab1cb9a7f37732383347ed4d6659a85ad2a8f42541d4c52f35152ff46e",
  "manifest_sha256": "e03117d98ec6ea9a83d0c14a76b65a529eb240892ed97352f188bacc8a871701",
  "negative_controls": [
    "missing, expired, revoked, cross-tenant, or client-supplied access identity reaches a mart query, artifact retrieval, or mutation",
    "administrator reads private conversation or document content without separately approved break-glass evidence",
    "grant, revocation, publication policy, or access audit row is updated or deleted instead of appended",
    "private app rows bypass RLS or return after cross-tenant object-ID guessing",
    "a contradictory resource privacy shape bypasses the publication policy for a materialized strategy or backtest result",
    "an audit event and its authorization decision carry different tenant identities or expose cross-tenant decision metadata",
    "ordinary app runtime reads administrator audit metadata or either immutable audit base table",
    "AuthorizationService hides publication-policy, authentication-failure, or delegation-revocation inputs required by authorize_access",
    "raw or staging access, arbitrary SQL, model-generated SQL, factor computation, Qlib invocation, or replay execution is introduced",
    "AccessContext, tenant, principal, role, entitlement, or publication-policy metadata enters factor, BacktestDataGateway, DecisionSnapshot, ReplayEventStream, or Qlib types",
    "a default route, release binding, scheduler, live credential, identity-provider request, or Production readiness claim is activated",
    "the experimental access DTOs are exported from the stable truealpha_contracts package root before E2 freeze"
  ],
  "producer_head_sha": "bf411226312fe981c3000f8c8478881692a9115d",
  "schema_version": 1,
  "stable_handoff": false
}
