{
  "accepted_rung": "E1",
  "base_sha": "9f7acc9f72fb84a3aefc355875ac4524ef497d2c",
  "batch_id": "D4-datahub-interface",
  "commands": [
    {
      "command": "uv run --package truealpha-contracts python -m pytest libs/contracts/tests/test_datahub.py -q",
      "exit_code": 0,
      "output_sha256": "33212a55d1b2b71ae0388f0b4e9fedcad7db708acd599aef214927f80bc3092a"
    },
    {
      "command": "uv run --package truealpha-contracts python -m ruff check libs/contracts/src/truealpha_contracts/datahub.py libs/contracts/tests/test_datahub.py",
      "exit_code": 0,
      "output_sha256": "c822b811c2e0019bee1324669633ca6aa6ae681c738309b0a31c13bbeebac766"
    },
    {
      "command": "uv run --package truealpha-contracts python -m mypy",
      "exit_code": 0,
      "output_sha256": "078ad557b0e49d76ac85a1c664751c812f27b0ae9d86c432126d163fed5c21cc"
    },
    {
      "command": "uv run --package truealpha-contracts python tools/check_delivery_governance.py",
      "exit_code": 0,
      "output_sha256": "3ce0a3f4b2b2d3fcc83181896297ac73b4b7b3034209f9e2b7514b3d55b0ebfa"
    }
  ],
  "created_at": "2026-07-15T14:38:45.633665Z",
  "evidence_id": "rung-evidence:D4-datahub-interface:5178c5baff733efc8fdeb88b64154768c14783dbbb11c989b7608f172585a489",
  "manifest_sha256": "10e16051b9271423413f5df0cde5f663aa95a8722428eb274866c2df4dffb64f",
  "negative_controls": [
    "mutable latest/current universe, source, schedule, parser, mapping, or confidence policy coordinate",
    "campaign, run, obligation, source-request, work-item, dispatch, attempt-outcome, source-vintage, raw-object, observation, assessment, or edge identity drift",
    "a provenance graph omits the required run-to-obligation or obligation-to-work-item capture path",
    "a work binding whose request omits its obligation's subject, capture requirement, or partition",
    "run-scoped work loses provider sharing across overlapping compatible lists",
    "a completed bundle omits a dispatch outcome, or an unchanged response reuses a vintage from another pinned request",
    "identical raw bytes erase a later attempt or a separate list obligation",
    "duplicate obligation, non-contiguous attempt, retry after terminal outcome, or unbounded retry",
    "binary-float, non-finite, unexplained, or out-of-range confidence component",
    "freshness, availability, applicability, quality, and confidence collapse into one mutable status",
    "recapture execution differs from its frozen dry-run selection or broadens its predicate",
    "factor-visible source, raw pointer, provider policy, or provenance branch metadata",
    "database, source, schedule, query provider, Qlib data binding, or release activation"
  ],
  "producer_head_sha": "cc2ff59a6c2625a22fd80fb943761786aa9ec0d2",
  "schema_version": 1,
  "stable_handoff": false
}
